{
  "schema": "kiana.capability-decisions.v1",
  "version": "1.0",
  "revision_id": "reference-decisions-2026-07-15-reviewed",
  "revision_kind": "successor",
  "review_revision": "reference-reviewed-2026-07-17",
  "reviewed_at": "2026-07-17T11:19:16Z",
  "decisions": [
    {
      "decision_id": "decision.12-factor-agents.mechanisms.review",
      "repo_id": "12-factor-agents",
      "capability_id": "cap.ref.12-factor-agents.mechanisms",
      "source_path": "reference/12-factor-agents/README.md",
      "source_revision_kind": "git_commit",
      "source_revision_value": "d20c728368bf9c189d6d7aab704744decb6ec0cc",
      "decision": "adapt",
      "reason": "Adapt reviewed mechanisms (natural language -> tool calls、own prompts/context、unified execution state、launch/pause/resume、small focused agents) into Kiana shared contracts at Intent Router、WorkflowRun、GateResult; governance approval does not assert product implementation.",
      "license_compatibility": "compatible",
      "license_evidence_ids": [
        "ev.license.12-factor-agents.review"
      ],
      "security_review": {
        "status": "approved",
        "rationale": "Reviewed source-only adaptation under Kiana trust, policy, and clean-room boundaries.",
        "evidence_ids": [
          "ev.security.12-factor-agents.mechanisms.review"
        ]
      },
      "risk": {
        "level": "medium",
        "summary": "Behavioral adaptation can import hidden assumptions or widen tool authority.",
        "mitigations": [
          "Use clean-room behavior alignment and Kiana-native contracts.",
          "Require target-owner tests and evidence before product completion."
        ]
      },
      "target_owner": "policy-runtime",
      "target_path": "kiana-tools/src/permissions.rs",
      "target_revision_kind": "artifact_sha256",
      "target_revision_value": "4de2845151951dc6cf3a63631407c66c379aedacf5ab02bcdca2bea64b81be03",
      "tests": [
        {
          "test_id": "test.governance.12-factor-agents.mechanisms.review",
          "path": "scripts/capability-governance-smoke.sh",
          "status": "passing"
        }
      ],
      "evidence_ids": [
        "ev.decision.12-factor-agents.mechanisms.review"
      ],
      "review_revision": "reference-review-2026-07-17",
      "freshness": "current"
    },
    {
      "decision_id": "decision.12-factor-agents.boundary.review",
      "repo_id": "12-factor-agents",
      "capability_id": "cap.ref.12-factor-agents.boundary",
      "source_path": "reference/12-factor-agents/README.md",
      "source_revision_kind": "git_commit",
      "source_revision_value": "d20c728368bf9c189d6d7aab704744decb6ec0cc",
      "decision": "reject",
      "reason": "Reject the audited boundary: 不把 12 条原则当框架依赖.",
      "license_compatibility": "compatible",
      "license_evidence_ids": [
        "ev.license.12-factor-agents.review"
      ],
      "security_review": {
        "status": "approved",
        "rationale": "Reviewed source-only adaptation under Kiana trust, policy, and clean-room boundaries.",
        "evidence_ids": [
          "ev.security.12-factor-agents.boundary.review"
        ]
      },
      "risk": {
        "level": "medium",
        "summary": "Ignoring the explicit boundary could duplicate product-specific architecture or weaken Kiana safety.",
        "mitigations": [
          "Retain the boundary as a reviewed negative decision.",
          "Re-open only through a new immutable decision revision."
        ]
      },
      "target_owner": "reference-governance",
      "target_path": "docs/reference_audit/kiana_personal_project_os_reference_audit_2026-07-09.md",
      "target_revision_kind": "artifact_sha256",
      "target_revision_value": "6f3e8c438ac906ae80fd4562033567361dd2cc6a18c9dcc08b9eab163e622cea",
      "tests": [
        {
          "test_id": "test.governance.12-factor-agents.boundary.review",
          "path": "docs/reference_audit/kiana_personal_project_os_reference_audit_2026-07-09.md",
          "status": "not_applicable"
        }
      ],
      "evidence_ids": [
        "ev.decision.12-factor-agents.boundary.review"
      ],
      "review_revision": "reference-review-2026-07-17",
      "freshness": "current"
    },
    {
      "decision_id": "decision.archon.mechanisms.review",
      "repo_id": "archon",
      "capability_id": "cap.ref.archon.mechanisms",
      "source_path": "reference/Archon/README-zh.md",
      "source_revision_kind": "git_commit",
      "source_revision_value": "55ef3bc7bff21d631176dc05e29545582f221505",
      "decision": "adapt",
      "reason": "Adapt reviewed mechanisms (command workflow、PR/issue automation、validate/review/artifact、repo config) into Kiana shared contracts at Project Orchestrator、artifact DAG; governance approval does not assert product implementation.",
      "license_compatibility": "compatible",
      "license_evidence_ids": [
        "ev.license.archon.review"
      ],
      "security_review": {
        "status": "approved",
        "rationale": "Reviewed source-only adaptation under Kiana trust, policy, and clean-room boundaries.",
        "evidence_ids": [
          "ev.security.archon.mechanisms.review"
        ]
      },
      "risk": {
        "level": "medium",
        "summary": "Behavioral adaptation can import hidden assumptions or widen tool authority.",
        "mitigations": [
          "Use clean-room behavior alignment and Kiana-native contracts.",
          "Require target-owner tests and evidence before product completion."
        ]
      },
      "target_owner": "project-os",
      "target_path": "kiana-tasks/src/workflow.rs",
      "target_revision_kind": "artifact_sha256",
      "target_revision_value": "3fbebed7222af8e5a14306374d0889f6fb9c6835af9fdaa768622efe9aa9c56a",
      "tests": [
        {
          "test_id": "test.governance.archon.mechanisms.review",
          "path": "scripts/capability-governance-smoke.sh",
          "status": "passing"
        }
      ],
      "evidence_ids": [
        "ev.decision.archon.mechanisms.review"
      ],
      "review_revision": "reference-review-2026-07-17",
      "freshness": "current"
    },
    {
      "decision_id": "decision.archon.boundary.review",
      "repo_id": "archon",
      "capability_id": "cap.ref.archon.boundary",
      "source_path": "reference/Archon/README-zh.md",
      "source_revision_kind": "git_commit",
      "source_revision_value": "55ef3bc7bff21d631176dc05e29545582f221505",
      "decision": "reject",
      "reason": "Reject the audited boundary: 不复制其完整 GitHub 自动化作为 P0.",
      "license_compatibility": "compatible",
      "license_evidence_ids": [
        "ev.license.archon.review"
      ],
      "security_review": {
        "status": "approved",
        "rationale": "Reviewed source-only adaptation under Kiana trust, policy, and clean-room boundaries.",
        "evidence_ids": [
          "ev.security.archon.boundary.review"
        ]
      },
      "risk": {
        "level": "medium",
        "summary": "Ignoring the explicit boundary could duplicate product-specific architecture or weaken Kiana safety.",
        "mitigations": [
          "Retain the boundary as a reviewed negative decision.",
          "Re-open only through a new immutable decision revision."
        ]
      },
      "target_owner": "reference-governance",
      "target_path": "docs/reference_audit/kiana_personal_project_os_reference_audit_2026-07-09.md",
      "target_revision_kind": "artifact_sha256",
      "target_revision_value": "6f3e8c438ac906ae80fd4562033567361dd2cc6a18c9dcc08b9eab163e622cea",
      "tests": [
        {
          "test_id": "test.governance.archon.boundary.review",
          "path": "docs/reference_audit/kiana_personal_project_os_reference_audit_2026-07-09.md",
          "status": "not_applicable"
        }
      ],
      "evidence_ids": [
        "ev.decision.archon.boundary.review"
      ],
      "review_revision": "reference-review-2026-07-17",
      "freshness": "current"
    },
    {
      "decision_id": "decision.ecc.mechanisms.review",
      "repo_id": "ecc",
      "capability_id": "cap.ref.ecc.mechanisms",
      "source_path": "reference/ECC/README.md",
      "source_revision_kind": "git_commit",
      "source_revision_value": "38a7ebbe3294be9bfda5612c6d696742ade6fbb2",
      "decision": "adapt",
      "reason": "Adapt reviewed mechanisms (cross-harness skills/agents/hooks/MCP、operator status、AgentShield/security、adapter matrix) into Kiana shared contracts at Trust Model、plugin policy、status payload; governance approval does not assert product implementation.",
      "license_compatibility": "compatible",
      "license_evidence_ids": [
        "ev.license.ecc.review"
      ],
      "security_review": {
        "status": "approved",
        "rationale": "Reviewed source-only adaptation under Kiana trust, policy, and clean-room boundaries.",
        "evidence_ids": [
          "ev.security.ecc.mechanisms.review"
        ]
      },
      "risk": {
        "level": "medium",
        "summary": "Behavioral adaptation can import hidden assumptions or widen tool authority.",
        "mitigations": [
          "Use clean-room behavior alignment and Kiana-native contracts.",
          "Require target-owner tests and evidence before product completion."
        ]
      },
      "target_owner": "extensions",
      "target_path": "kiana-skills/src/lib.rs",
      "target_revision_kind": "artifact_sha256",
      "target_revision_value": "bd123f9b5f364a565ec031af1e0e39eaf964cfa98810bfd1c303340dcba0937a",
      "tests": [
        {
          "test_id": "test.governance.ecc.mechanisms.review",
          "path": "scripts/capability-governance-smoke.sh",
          "status": "passing"
        }
      ],
      "evidence_ids": [
        "ev.decision.ecc.mechanisms.review"
      ],
      "review_revision": "reference-review-2026-07-17",
      "freshness": "current"
    },
    {
      "decision_id": "decision.ecc.boundary.review",
      "repo_id": "ecc",